{
  "job_id": "new-job",
  "image_id": "01-main",
  "asset_sha256": "0000000000000000000000000000000000000000000000000000000000000000",
  "confirmation_digest": "0000000000000000000000000000000000000000000000000000000000000000",
  "status": "FAIL",
  "reviewer": "image_qc",
  "reviewed_at": "not-reviewed",
  "checks": {
    "product_consistency": "FAIL",
    "physical_logic": "FAIL",
    "amazon_rules": "FAIL",
    "copy_accuracy": "FAIL",
    "technical_quality": "FAIL"
  },
  "issues": [
    {
      "severity": "critical",
      "type": "not_reviewed",
      "description": "尚未检查实际图片",
      "repair_instruction": "读取产品参考图和当前版本图片，逐项检查后填写真实结果。"
    }
  ]
}
